{
  "schema_version": "ailuros.timeline.v0",
  "run_id": "ailuros-timeline-v0-sample",
  "created_at": "2026-06-06T00:00:00.000Z",
  "events": [
    {
      "event": "INPUT_CLASSIFIED",
      "run_id": "ailuros-timeline-v0-sample",
      "timestamp": "2026-06-06T00:00:00.000Z",
      "metadata": {
        "input_type": "pdf",
        "doc_category": "financial_terms",
        "input_size_chars": 5000
      }
    },
    {
      "event": "LLM_REQUEST",
      "run_id": "ailuros-timeline-v0-sample",
      "timestamp": "2026-06-06T00:00:00.000Z",
      "metadata": {
        "model": "claude-sonnet-4-20250514",
        "prompt_version": "v1.0",
        "tier": "HIGH",
        "temperature": 0.1
      }
    },
    {
      "event": "LLM_RESPONSE",
      "run_id": "ailuros-timeline-v0-sample",
      "timestamp": "2026-06-06T00:00:00.000Z",
      "metadata": {
        "model": "claude-sonnet-4-20250514",
        "prompt_version": "v1.0",
        "tier": "HIGH",
        "temperature": 0.1
      }
    },
    {
      "event": "EVALUATION_RESULT",
      "run_id": "ailuros-timeline-v0-sample",
      "timestamp": "2026-06-06T00:00:00.000Z",
      "data": {
        "is_valid": true,
        "issue_codes": [],
        "severity": {
          "blocking": [],
          "repairable": [],
          "log_only": []
        },
        "scan_friendly": true,
        "audit_issue_count": 0
      }
    },
    {
      "event": "OUTPUT_GENERATED",
      "run_id": "ailuros-timeline-v0-sample",
      "timestamp": "2026-06-06T00:00:00.000Z",
      "metadata": {
        "output_type": "memo",
        "word_count": 500,
        "section_count": 5
      }
    },
    {
      "event": "RUN_COMPLETED",
      "run_id": "ailuros-timeline-v0-sample",
      "timestamp": "2026-06-06T00:00:00.000Z",
      "data": {
        "duration_ms": 0,
        "error_code": null
      }
    }
  ]
}